<?xml version="1.0" encoding="UTF-8"?>
<!--
/**
 * Copyright 2017 Adobe
 * All Rights Reserved.
 */
-->

<entities xmlns:xsi="http://www.w3.org/2001/XMLSchema-instance"
        xsi:noNamespaceSchemaLocation="urn:magento:mftf:DataGenerator/etc/dataProfileSchema.xsd">
    <entity name="simpleParamData" type="data">
        <data key="name">name</data>
        <data key="uniqueNamePre" unique="prefix">prename</data>
        <data key="uniqueNamePost" unique="suffix">postname</data>
    </entity>
    <entity name="testEntity" type="sample">
        <data key="sampleField">value1</data>
        <requiredEntity type="test">originalValue</requiredEntity>
        <requiredEntity type="test3">originalValue3</requiredEntity>
    </entity>
</entities>
