<?xml version="1.0" encoding="UTF-8"?>

<!--
 /**
  * Copyright Â© Magento, Inc. All rights reserved.
  * See COPYING.txt for license details.
  */
-->

<entities xmlns:xsi="http://www.w3.org/2001/XMLSchema-instance"
        xsi:noNamespaceSchemaLocation="../../../../../src/Magento/FunctionalTestingFramework/DataGenerator/etc/dataProfileSchema.xsd">
    <entity name="simpleData" type="simpleData">
        <data key="firstname">John</data>
        <data key="lastname">Doe</data>
        <data key="middlename">Tiberius</data>
    </entity>
    <entity name="uniqueData" type="simpleData">
        <data key="firstname" unique="prefix">John</data>
        <data key="lastname" unique="suffix">Doe</data>
    </entity>
</entities>
